{
  "name": "python-metaclass",
  "description": "探索 Python 元类：type、__new__、__init_subclass__、描述符、属性拦截",
  "created": "2026-03-12",
  "language": "python",
  "tags": ["metaclass", "meta-programming", "oop", "advanced"],
  "ai_participation": "full",
  "ai_model": "claude-3-sonnet",
  "source": "ai"
}
